label70,当他还在妈妈肚子里的时候，爸爸就溺水身亡了，出生后一年，妈妈弃他而去，而且一去不返
label85,需要我们大家的共同援救，家庭、学校、社会缺一方都不可
label4,健康
label59,一般
label6,鉴于心理有缺陷的他常常会单独行动
label16,但我针对他每节上课总是迟到的坏习惯提出了附加条件
label79,但我针对他每节上课总是迟到的坏习惯提出了附加条件——上课不能迟到，若做不到便立即回原位，他也欣然接受。
label78,我还结合本学期在整个初中阶段的重要性和他谈谈学习的重要性
label2,他
label67,鉴于心理有缺陷的他常常会单独行动，且总是不知去向
label84,对这样的一位特殊学生，我始终有一颗宽容的心，始终不放弃对他的引导。
label77,我得指出目前他在纪律方面存在的问题，仅仅是晓之以理也不行
label2,男
label11,老师批评一下有时都要与你顶嘴或者动手的男生来讲
label30,过多的时候以自我为中心、脾气倔强
label15,不遵守课堂纪律，上课经常讲话，做小动作，影响老师上课
label11,课后大声喧哗，还欺负同学
label27,作业要么不做，要么抄袭
label62,除了他几个“哥儿们”，和其他同学之间不能和睦相处
label30,对老师的批评教育，他是屡教不改
label72,通过观察我发现其实外表坚强的他更需要老师对他的关注与肯定
label1,初一
label78,我经常找他谈话，很坦诚地告诉他他存在的潜力及我的担心
label98,找到机会就表扬他
label90,针对他的倔强脾气，我每次都给他一段时间的冷静
label78,考虑到他强烈的自尊心，总把他叫到一个没人的地方与他谈话。
label11,他在课堂上与一位同学发生了矛盾，我转过去在黑板上写了几个字他就打了那位学生一个巴掌。
label66,由于郭道斌倔强的脾气，所以在班级里常常会与同学发生这样那样的矛盾
label4,健康
label38,完整家庭
label49,父母健康
label2,女
label32,曾一度迷恋于言情小说，学习精力很不集中
label15,在英语课上，居然从她的课桌内传出了音乐声
label17,自己撒谎不说，还耽误了大家听课
label15,当老师问起她时，还当堂撒野，推说自己没带手机
label74,她说这次模考让她失去了所有的信心，干脆就自暴自弃起来。
label90,我抛了几个让她必须思考且需回答的原因，层层深入，一个比一个尖锐，让她明白我的原则性
label79,我鼓励她，认清形势，奋发图强，不到最后，决不放弃，并我和她约定，手机暂由我保管至中考结束，她也欣然同意
label111,下午我就让她妈妈到校拿手机，同时嘱咐她暂时不予追究，看她近期表现，待到暑期再发落。
label1,初中
label4,健康
label7,一般儿童
label38,完整家庭
label49,父母健康
label59,一般
label32,在上学期的时候经常进网吧，最晚时将近九点家长打电话来说还没回家，最后在老虎机上找到他，还玩得正欢
label95,平时这位学生的排车工作做得比较到位，后来改他擦窗户，比原来的同学负责多了，这时我在班上及时表扬了他
label89,另外也对他单独谈心，把他父亲的不容易讲给他听，他慢慢地低下了原来满不在乎的头
label2,他
label98,在平时的班主任工作中，我们要善于发现学生的闪光点，激发学生的积极性 。
label4,健康
label38,完整家庭
label49,父母健康
label9,和他家长也联系了多次，由于是外地人，在工地上做工，每天没有多少时间在家
label42,在工地上做工，每天没有多少时间在家，对他也是鞭长莫及。
label111,这学期我也和他父亲联系了两次，放学后都能及时回家，而且以往课堂上经常讲话的现象也收敛了很多。
label77,在工地上做工，每天没有多少时间在家，对他也是鞭长莫及。
label74,耐心细致做好说服教育和引导工作，打消他们的思想顾虑，帮助他们树立自尊心和自信心，是可以改变他们的
label16,我环视一遍机房，怎么又是××迟到了。
label16,看着他的空座位我又想起了上次课他不但迟到了还没有带书没穿鞋套
label84,老师小时侯也迟到过。有时是因为吃饭晚了，有时是因为睡过了头……当然，我不希望你们迟到
label79,但你们要学会安排好时间，解决好自己遇到的困难，做到尽可能不迟到。
label4,健康
label2,他
label77,如果谁迟到了，就请你轻轻地自己进来，像小猫一样悄悄地回座位坐好，不要影响其他同学。”
label27,陈某的作业又没有做，我刚走进教室，还没来得及说话，就被课代表声音打断了
label95,这一节课居然举了好几次手，并回答了两个问题，其中一个还有一些难度，我表扬了他
label79,看你这节课表现很好的分上，饶了你，但书写一定要认真啊！还有要认识到自己的错误，争取下次不这样
label4,健康
label2,他
label59,一般
label77,可是好景不长，这才几天，他又不完成作业了，难道上次的处罚他都忘了，要不要再厉害些，让他记得时间长一些。可这样管用吗？
label2,男
label15,性格倔强得很，又非常调皮，上课不认真，扰乱他人的学习
label62,下课胡乱打闹，同学们对它是敢怒不敢言说
label27,从不交作业，每天不是课任老师告状就是同学告状。
label32,从他父母处了解到这学生以前在丰裕中学学习，跟爷爷、奶奶生活在一起，经常去网吧打游戏
label32,在网吧打游戏，并且母亲叫他回来做作业，他不肯
label73,我在检讨自己，不该当着这么多人的面丢他的面子，也在反复思考
label92,我决定大胆起用这个学生，让他担任我们班级的电脑管理员，以此方式给予他自信
label94,你的电脑弄得不错，很聪明，我决定让你当我们班上的电脑管理员。
label98,要尽量发掘“潜能生”的闪光点，“潜能生”并不是一无是处
label4,健康
label38,父母怕影响学习，所以转到这里
label49,父母健康
label2,男
label15,上课从来坐不正，嘴也讲个不停，是典型的很令众人头疼的“坏学生”，
label95,我真的很佩服你，你虽然上课从不专心，但却会解答问题，并且凡是做了的作业都很正确，太不可思意了
label79,你已当了七年多的学生，我就不多罗嗦教你怎样学习了，一句话：下定决心开始努力！我会时刻注意你的表现，等待你的成绩
label98,我又大大地表扬了他，并且在课上把他作为进步学生的典型树立榜样，我还特别号召全班同学以掌声鼓励他。
label99,我还特别号召全班同学以掌声鼓励他。
label4,健康
label74,我坐在他面前，故意夸张地摆出发现新大陆似的眼光注视他，显然他显得不自在，左晃右让想躲开我的目光
label1,初二
label2,他
label21,他和别的孩子不一样，沉默寡言，课间常常躲在角落里，只顾自己一个人看书
label12,性格十分孤僻，行为散漫，个人行为习惯特别差，常常和班里同学吵架
label11,前不久和班里一学生打架，因为打急了，就用拳头砸，因此还砸伤了两个孩子。
label62,在班里很不合群，其他孩子提到他，无一例外都是反对。
label62,没有人愿意跟他在一起，没有人跟他交朋友。
label69,孩子之所以孤僻，是因为他们无法找到知心的朋友。
label86,我们要用爱和温情去滋润孩子的心灵，让自己的孩子远离孤独的困扰。
label69,父母又很少让他们出去与同伴一起玩耍
label73,在与人交往中屡次遭到拒绝后，孩子会产生挫折感，因而寻求自我保护而不愿与他人交往。
label78,及时沟通，用心倾听阳光似的心灵，花朵般的绽放是每个人的期望。
label36,他在很小的时候父母就离婚了，他跟着父亲过，父亲又娶了个后妈，后妈对孩子管教十分严格。
label40,父亲又娶了个后妈，后妈对孩子管教十分严格。
label70,造成他这一现象的原因就是缺少倾听，特别是家长和老师的倾听。
label70,家庭变故已经给他的心灵造成了很大的创伤，使他自我感觉不能像正常学生那样得到父母的抚爱和家庭的温暖，许多要求得不到满足，不愿和人交往，行为偏激。
label86,我决心以行动去关心他，消除他偏激的心理
label78,我找机会在放学后，单独找他谈家里的事、同学的事，谈他喜欢读的书等，并经常告诉他要衣着整齐，自己的事情自己要做好。
label111,我把他的情况告诉了他的父母，要求他们也配合，在我的劝说下，他们也愿意改换一种教育方法，也开始尝试着尊重他的看法，满足他的一些要求。
label4,健康
label7,一般儿童
label49,父母健康
label2,男
label1,初二
label58,性格非常单纯善良，与同学关系很融洽，与老师关系亲密，为人真诚
label32,初三时候和B成为好朋友，经常以一起写作业的名义把B 带到他家去玩游戏看电视
label27,上课评讲试卷我发现A居然试卷都没有做
label79,抓住这个机会来一次能够真正起到作用的德育教育了
label78,在他稍微缓和下来之后我就把他领出办公室，单独和他谈心。
label76,自从你和B做了朋友之后，我知道你们很投缘，但是你要知道你和他在一起你退步了，他就会因为这个而背上黑锅——所有的人都会认为他是个坏学生，不仅自己坏，还把原来好的你带坏了。”
label4,健康
label90,一件件的夸他以前所取得的种种成绩，做的一件件的好事，一个个老师对他的好的看法，总之实事求是、毫不差漏的把他以前的优秀的一面展现出来，唤醒他的记忆和自尊
label2,男
label3,14岁
label1,八
label28,学习行为习惯很差，自己经常上课一节课能听15分钟就不错了
label15,不仅如此还干扰别人，老师、同学讲话时喜欢插嘴，我行我素，自我约束能力差。
label78,多次找他谈话，与他聊些日常生活琐事，不去讲他的一些毛病
label113,面对他这种情况，我及时从其他同学、其他老师、其妈妈、其外公外婆那里了解了一些情况
label85,于是我转换其他的方法，安排了班委和成绩较好的同学坐在他附近帮助监督他的学习，时刻注意他
label95,一有细小的进步就向我汇报，我及时表扬他，使他在老师及时的肯定和表扬中感受到自己是有希望的，效果很好。
label4,健康
label37,完整家庭
label49,父母健康
label74,使他在老师及时的肯定和表扬中感受到自己是有希望的
label59,一般
label2,男
label11,他经常违反纪律还欺负同学
label62,班级中几乎所有的同学都讨厌他
label42,和他的母亲交谈中我得知这个孩子的母亲是外地人，父亲不怎么管他
label72,细细分析起来，这种孩子为了引起老师和同学的注意，便以不学习、违反纪律的方式来引起人们的关注，满足自己的情感需要。
label94,我有意的让他回答一些对别人来说极其简单，对他来说有难度的问题
label95,如果他主动举手回答问题，我会先叫他，答对了给予表扬，使他获得进步的喜悦，答错了进行鼓励，给他以信心。
label4,健康
label38,完整家庭
label49,父母健康
label7,一般儿童
label2,男
label1,七
label3,13岁
label27,学习缺乏主动性。经常不能完成作业，不刻苦，缺乏毅力，上课没有精神。
label15,经常上课破坏课堂纪律，不服从任课老师管理，有依赖和惰性心理。
label37,单亲，又是独生子女
label41,母亲溺爱娇惯，使他养成了自由散漫、性格。
label27,学习缺乏自觉性，老师布置的作业完不成，没有毅力克服学习上的困难
label15,上课破坏课堂纪律，致使基础打得不牢，学习成绩差
label73,基础打得不牢，学习成绩差，产生逆反心理，对学习厌烦
label77,鉴于其母亲对他的溺爱骄纵，缺乏一种必要的约束力，凡事随心所欲，使他生活在很松弛的生活状态中
label75,由于学习成绩一般，又缺乏认真、刻苦的学习精神，对较难的问题不愿意动脑筋，又不肯问别人，不懂装懂，长期发展下去，知识掌握不牢
label26,对较难的问题不愿意动脑筋，又不肯问别人，不懂装懂
label85,我让同学们主动和他玩、谈心，让他体会到班级的温暖和快乐
label102,我则采取文火慢工的方法，从基础着手，采用帮学帮练
label84,没有放松对他的教育，用爱心去关怀爱护，用爱心去严格要求，使他真正理解教师对他的关爱
label98,值日生工作他认真做，就给予鼓励；主动帮助教师拿教具等则给予肯定。
label4,健康
label7,一般儿童
label59,一般
label2,他
label27,作业经常不做
label12,上课不认真听讲，反了错误后，老师对他进行教育，辱骂老师
label16,有时不能按时到校上课，结识不良学生和青年
label1,七年级
label11,和同学讲话，一不投机，还合其他同学打架，在跑操训练时，挤撞其他同学
label9,外地户籍
label77,家长管教不力
label11,经常在外面打架，成绩很不理想
label96,只有一发现他有什么错误行为，我立即指出
label12,其间在等待家长的过程中，我因不认识其家长，他还骂我：“你眼睛呢？”
label40,家长来了以后，我先告知家长孩子的问题所在，家长先是一阵打。
label90,我就问他：“如果你是老师，你会周末处理这件事？我们来个换位思考！班级和学校还有这样的发型吗？”
label82,平时我也找班上的班干部，要求他们多关注他，多关心她，带领他一起进步
label4,健康
label38,完整家庭
label49,父母健康
label76,他开始也觉得理直气壮
label59,一般
label2,他
label41,而且由于长期的家庭溺爱，他养成了十分任性的脾气
label12,和老师顶撞已成为他的家常便饭
label15,他仍然是一会儿交头接耳，一会儿骚扰前后同学搞恶作剧，成了团队中一目了然的“小丑”。
label77,而且由于长期的家庭溺爱，他养成了十分任性的脾气
label90,又有针对性的特别表扬了朱某前后左右的多名学生，不过，在语言上我使用了一种比较含糊的表达
label4,健康
label7,一般儿童
label82,借班级势力或借某种集体因素制造假象，使他自己觉得自己的能力也十分强大
label38,完整家庭
label49,父母健康
label7,一般
label1,七年级
label16,他伙同几位学生躲在厕所里，不去做操，最后被体育老师抓去大操场
label15,老师指定其他同学看管纪律，他却不管不顾，大声讲话、说笑，影响其他同学学习
label27,对于学习，他也表现得极其懒惰，该背的内容不会背，也不想背，默写从不订正
label27,周末练习只做一半，还有大片空白就放在那
label78,我首先找他谈话，与他分析利弊，让他明白自己身上的缺点已经严重的阻碍他了他的进步。
label79,并告诉他，他很聪明，只要努力，完全可以与班上的优秀生齐头并进。
label111,还两次请他的家长到校，共同教育他，感化他。
label95,他在一步步的进步着，期中考试他语文考了七十几分。他高兴的一蹦三尺高，我适时的鼓励他、表扬他
label85,我带着班上的几位优秀生到他家家访，去时还带了他细化吃的零食，我让同学为他补课，并告诉他，同学们都希望他早点返校，早日回到班级这个温暖的大家庭中。
label4,健康
label7,一般儿童
label38,小赵的爸爸是飞行员，妈妈是公务员
label49,小赵的爸爸是飞行员，妈妈是公务员
label59,一般
label77,他在纪律上表现以自我为中心，极为随意，极为散漫
label2,他
label11,刚才有人打架，我找到打架的两位学生——学生A和学生B
label11,大个子学生A无缘无故地逗惹小个子学生B，将学生乙按倒在地，学生B忍无可忍地予以还击，学生甲于是就“理所当然”地动手打人。
label11,经常骚扰女同学，经常与同学争吵、打架
label73,因其相貌而被同学乱起绰号称为“猿某人”（即历史课本中所提的史前人类），常常被人取笑，他也常常气愤至极
label73,：“其实这是A同学被扭曲的自尊心所驱使的
label72,A自恃身体强壮，头脑不差，总想赢得别人的尊重和关注，总想在班级拥有自尊和地位
label73,而他痛苦、愤怒、他那被扭曲的自尊心促使他要报复，要用暴力来换取别人的尊重
label72,要用骚扰来换取异性的关注
label90,首先提出问题：“为什么A要经常欺压同学呢？”教室里一片静寂
label4,身材高大、体格健壮
label7,一般儿童
label79,我心中已有结论，决定以此为契机对全班同学进行一次透彻的教育
label1,八
label2,他
label15,他是一个问题学生，上课要么扰乱他人学习，要么低头搞小动作
label62,课间胡乱打闹，同学间经常闹矛盾，同学们都嫌弃他
label9,原来他是外来民工子女，父母来自山东，在扬中卖水果
label42,父母来自山东，在扬中卖水果，根本就没有时间教育其儿子，何况也管不住，双休日更是放任自流
label86,我首先设法接近他，处处关心他，让他感受到我这位“新老师”没有对他另眼相看
label95,上课只要有了一点小小的进步，我就使劲的表扬他。
label77,原来他是外来民工子女，父母来自山东，在扬中卖水果，根本就没有时间教育其儿子，何况也管不住
label4,健康
label38,完整家庭
label49,父母健康
label70,心理学家认为“爱是教育好学生的前提”。对于这样特殊家庭的后进生，以关爱之心来触动他的心弦
label2,他
label1,初一
label27,课堂上不再认真听讲，总是萎靡不振地趴在桌上，作业也总是迟迟不交，甚至不写
label34,果不其然，星期六的晚上，他离家出走了
label37,从小父亲过早的去世，在他的童年留下了不快乐的阴影。
label8,一直以来，都是和爷爷奶奶生活在一起，母亲在外地工作
label75,随着课程越来越深，平时基础不够牢固，课后不肯花时间去忙，导致成绩越来越差，当成绩原来越来越差后，想加油也没处使力
label74,这样的恶性循环，对学习失去了信心，抱着破罐子破摔的想法，浑浑噩噩的过日子
label76,在这些三朋四友的感染下，学会了利用网络来充实自己空虚的灵魂，并变得脾气暴躁，效仿一些不良行为。
label78,于是我调整语气，开始了我们之间语重心长的谈心
label11,聚众打架斗殴
label18,曾经参与了敲诈勒索的活动
label89,讲到了特殊家庭的孩子需要更懂事
label4,健康
label49,父母健康
label59,一般
label2,男
label11,自习课上，当有同学讲话时，他会大声呵斥，甚至有一次还在用粉笔头扔同学以示警戒。
label16,比如午睡时，有同学眼睛没闭上的，他就会在班上大吼并指手画脚，严重影响了其他同学休息
label79,我找到了他，动之以情，晓之以理，让他知道自己一言一行在班级所起的影响，提醒他要注意工作的方式和策略
label15,班级明确规定不许吃零食，他作为班干部带头吃起了零食，还在美术课上讲话等等
label4,健康
label76,作为班委，自己也要以身作则，不能要求同学做到的自己却做不到。
label2,他
label16,周一早上他母亲打电话请假说可能要迟到
label11,他周二在路上与其他班的一学生发生摩擦，互不相让，导致两人动手
label40,父亲劝说无效，动手狠狠地打了他
label40,家长气势汹汹地说不管他了，他也管不了儿子，晚上父亲又打了他
label11,他因为与十三班的学生的事差点又动手打架
label77,父亲忙于赚钱，很辛苦，又不善于与儿子沟通，儿子犯了错误，不耐心教育，唯一的教育方式就是“打”，
label105,周四上午与母亲进行了交流，希望她尽到一个妈妈的责任，同时与其父亲好好沟通，改变自己的教育方式，以说服教育为主，不要再打孩子，她答应了。
label78,周五放学时，我与周同学一起回家，一路上再次与他谈心
label9,周来自安徽，父亲在私人老板处打工，开挖掘机，经常外出开夜工，母亲爱好打麻将，有时不分昼夜
label4,健康
label70,从父子俩的交谈中得知，父子之间互不信任，缺少沟通
label54,母亲爱好打麻将
label98,要善于抓住他们身上一个个小小的闪光进行鼓励、表扬
label38,完整家庭
label49,父母健康
label59,一般
label1,七
label18,放在何晨那儿的班费被偷了
label2,他
label98,你能认识到自己的不足，这很好，说明你还是一个诚实的学生。
label79,边说边观察到他的表情起了变化，于是又进一步引导他
label4,健康
label76,要知道，有些不该做的事情你做了，你不说，并不代表别人不知道。但是如果事情非得到别人一个个出来指证你，那事情就难以收拾了。”
label2,男
label1,初中
label33,有一个在小学时就对他有“好感”的女生，就经常向他“表白”，寻找一些途径增进与他的联系。渐渐地，这个男生就被“征服”了。从此，他们开始了一段“地下情”。
label76,在与他的交流后，我发现这个孩子对“恋爱”这个词的认识是很肤浅的
label63,他“恋爱”的理由很简单，主要因为“恋爱”在当代的网络、电视等媒体中的出现率是相当高的，那么在一个正当青春发育期的少年眼中，他认为“恋爱”就是一种时尚
label78,我从以下方面和他进行第二次聊天：了解他的理想，并让他对于如何能实现自己的理想制定目标
label78,还经常与他以朋友的状态聊天，了解他每个时段的学习、生活状况。
label105,我还与他家长沟通。让他父母在正确的认识“早恋”之后，多尊重、理解、关爱孩子
label90,我先让他回去好好自我反思一下
label4,健康
label38,完整家庭
label49,父母健康
label58,他一直是小学老师心目中的“宠儿”，也是同学们心目中的“男神”。
label79,对于一名成绩优异的学生更加要严格要求自己，使自己处于不败之地。我还帮助他正确的认识“早恋”。
label2,男
label18,通过同学们的描述，我基本可以断定是那位有嫌疑的男生拿的了
label84,我也感到了一丝欣慰，我相信我的真诚感动了她，而他也战胜了自己。
label90,我先是一直看着他，一言不发，大约过了三分钟，我开口了，我说：XXX，你知道我找你干什么吗？
label4,健康
label79,我在跟他个别交流的时候，谈得很多，我跟他详细列举了这件事情的严重性和危害性。
label76,他也向我敞开了心扉，为自己的一时贪念而悔恨不已，要我给他改过自新的机会
label1,九年级
label16,发牢骚故意踢通了一扇柜门，其他学生报告后我找他，他说他不是故意的，可以不赔偿
label78,我还是在网上搜集了一些资料，找到与他谈话的切入点，展开了心理攻势
label83,我跟他讲一个关于废纸的故事
label83,我跟他讲一位名人到瑞士访问的故事
label79,应该冷静平和地挖掘学生犯错的深层原因，给学生讲道理，实事求是地指出他的缺点
label4,健康
label2,他
label77,这么一个不懂责任的学生！他不能承担自己的责任，连家长也无动于衷
label38,完整家庭
label2,男
label26,文科成绩不冒尖，甚至可以说是差！
label27,这从此后的文科作业情况可以看出来：不做或少做，看的或度的作业就糊
label78,在这种情况下，我多次找他谈心
label102,要求每天晚上先做文科作业，再做理科作业
label109,于是我要求其家长必须按照我的要求去看孩子的晚自习
label76,通过几次电话了解，他对看的和读的作业简直就不当一回事
label4,健康
label38, 完整家庭
label49,父母健康
label59,一般
label7, 一般儿童
label1,初三
label2,男
label27,学习对他来说很无所谓，由于基础差导致初三学期中学习跟不上，所以不管什么文化课他都不学，每一节课没事就睡觉
label14,我发现他不见了，仔细一“搜索”看见他用两个凳子铺开躺在后面睡，这成何体统，当时我心里非常气愤
label79,我问他今天是否身体不好还是其他原因要这样做，并说一些做人的大道理及人与人应互相尊重之类。
label78,我时不时地找他来谈心，说说他的家庭
label92,有时叫他帮我做点事，批批作业，收收本子
label95,因为他语言表达很有天赋，在全校比赛中竟得了个一等奖，我在全班同学面前大大的表扬了他
label73,他们在意家长对他们的看法，在意同学之间的评论，更在意自己闪光点是否得到了班主任的认可
label4,健康
label73,人都有被认可的需要，被肯定的需要，学生更是如此
label2,男
label16,经常出现进入学校不配戴胸卡，食堂就餐不排队的情况
label16,在学期结束前，还旷课两天
