label77,我总是不厌其烦的进行教育，严厉的，温柔的，晓之以理，动之以情，是非之分，作人之道等等，因为我认为对于这种脾气的孩子，公平的公正的给他讲道理的话，会比只去严厉指责的效果好很多
label78,于是我深吸了一口气，开始转变谈话角度，谈到了我自己，我和他的关系，也谈到了他身上的毛病，谈到了他的未来，他的人生之路等等。
label73,出乎意料的是，第二天我收到了小米的一封信，信的大概意思是：一开学的时候他觉得我这个老师很好，很真心地对每个学生，他以前从不认为可以和老师交心，但是却相信可以和我交心，但是上次晚自习翘课我和他父亲反映他的事，让他觉得我并不是他的朋友，不了解他?也从此对我产生了抵触心理。
label84,如果班主任像对待其他学生一样尊重他的人格，尊重他的权利和义务，与他心心相通，以诚相待，给他创造一种和谐的氛围，这对于激发他们的自我转变的主动性和积极性是很有效果的。
label66,但是他有个缺点，遵守纪律意识很淡薄，脾气很急，特别容易暴躁。
label15,但是他有个缺点，遵守纪律意识很淡薄，脾气很急，特别容易暴躁。曾经有一次在晚自习课上，因为他和两个学生讨论问题影响班里纪律，值班老师不允许，他很不满意，就与值班老师发生口角，态度很不好
label80,看到他的信，我真的很是触动，当即给他写了回信，表扬他的懂事和进步的决心，我相信只要他肯努力，一定能取得更大的进步
label98,表扬他的懂事和进步的决心，我相信只要他肯努力，一定能取得更大的进步
label1,高一学生
label37,离异家庭的孩子
label41,他自幼跟随母亲生活，因为没有父亲，母亲对他十分宠爱，养成了他任性，急躁的性格
label32,他母亲来校找我反映了张同学学习不刻苦，迷恋游戏机等情况
label12,我还没来得及找他谈话，晚上回家，他就和母亲大吵了一场，差一点还动了手
label77,我耐心听他说完所有的理由后，有针对性地发表了我的看法
label111,我也因此和他母亲交换了在家庭中如何学会和孩子沟通并因势利导做好孩子思想工作的体会，他母亲十分感激
label82,向全班学生介绍我班一女同学为了报答父母刻苦学习的事迹;
label88,"写了一篇以“谁言寸草心,报得三春晖""为话题的作文,并进行了交流,讨论"
label78,首先详细地了解了事情的前因后果。找张同学进行谈心
label76,高一学生张同学是一个离异家庭的孩子，他自幼跟随母亲生活，因为没有父亲，母亲对他十分宠爱，养成了他任性，急躁的性格
label2,女
label3,15岁
label1,八年级学生
label37,离异家庭
label8,起初她和爷爷及后奶奶一起生活，是爷爷后来的小儿子。这个学期和自己的奶奶一起生活。父母各自在外地工作
label23,父母经常分别打电话给她，诉说各自的不容易，甚至母亲在电话里向她哭诉……她很烦，甚至产生了轻生的念头
label24,这种家庭的忽然变故，使她失去原有的心理平衡，变得更加焦虑不安，感到孤立无助，继而逃避，这是一种高度焦虑症状的消极自卑心境
label69,时又特别渴望得到关爱
label42,认识到这时候家长和老师不闻不问，或批评责骂她
label21,在学校，师某经常独自一人，很沉默，不与人交流
label111,加强与家庭联系，说服家长尽责，帮她摆脱心理困境
label104,我加强与其家庭联系，让其父母认识到家庭教育的重要性和责任感，使这个不完整的家庭也承担起教育孩子的重任
label85,运用行为疗法，使她感受到集体的温暖，恢复心理平衡
label94,多次为她提供尝试成功的机会，让其体验成功的喜悦和荣誉，增加良性刺激，使她摆脱自闭心理，激发起自信心和上进心
label77,通过有教育意义的活动，创设一个宽松有益的心理环境，引导这孩子焕发起对美好生活的热情，增强其克服困难的信心和勇气
label22,心理压力更大，觉得自己在同学面前抬不起头来，不敢与同学交流，采取有意回避的态度，压抑自己
label14,上课一直要么搞小动作，要么乱说话影响别人;下课追逐打闹，喜欢动手动脚，常常违反学校和班级的规章制度，为班级抹黑;
label15,上课一直要么搞小动作，要么乱说话影响别人;下课追逐打闹，喜欢动手动脚，常常违反学校和班级的规章制度，为班级抹黑
label16,上课一直要么搞小动作，要么乱说话影响别人;下课追逐打闹，喜欢动手动脚，常常违反学校和班级的规章制度，为班级抹黑;
label16,上课一直要么搞小动作，要么乱说话影响别人;下课追逐打闹，喜欢动手动脚，常常违反学校和班级的规章制度，为班级抹黑
label13,还常常引发同学间的矛盾，许多同学都指责他，讨厌他，不和他一起玩;
label27,各门作业做的都不完整……几乎每天都要惹出一点事情
label41,家访中，我了解到他有一个双胞胎的哥哥，从小家人就非常溺爱他们
label12,就妈妈的话他一句也听不进去，妈妈说她一句，他能顶妈妈十句，
label76,通过多次家访后，了解到妈妈也拿他无能为力，任之放任。他感受到自己在家中的“地位”，所以养成了我行我素的不良习惯
label79,经过观察，我发现他劳动积极主动、踏实，为人诚实，所以，我经常叫他到办公室交谈，了解情况，相机鼓励他、激发他“你干活儿那样能干，在学习上只要自觉，你一定能行;只要你好好对待别人，同学们一定能喜欢你
label95,每当他有丁点进步时，我便适时鼓励与表扬他
label77,还借助班干部的力量共同帮助他，使他逐渐明白了做人的道理
label27,学习兴趣不高，不是特别在意成绩
label93,于是我就把运动会班级获得的奖品篮球交给了他，并郑重地对他说：“篮球以后有你保管，希望你能组建一支篮球队在比赛的时候为班争光
label99,在班内开始表扬他，号召大家向他学习。
label77,在课余时间找他谈心时，开始正面给他提出学习的要求
label80,采用多种形式对他进行鼓励，课堂提问表扬、作业本评语激励
label74,每个学生都有很强的自尊心，如果只是反复要求“一无是处”的学生努力学习，他一定不会坚持很久，而且会产生腻烦心理。
label27,他竟然在抄别的同学的试卷订正
label27,你上个星期才保证过要认真学习，你今天居然在抄作业，你太让我失望了
label13,然后我向后门走去，走出两步以后发现他并没有跟上来，我又提醒了一次，他似乎并没有要跟过来的意思。我伸手就去拉，他居然很用力地要甩开我的手，刚刚硬压下去的火陡然又串了上来，当班主任这么多年了，还没哪个学生敢跟我如此正面冲突呢
label88,我让该同学在网上找了关于抄作业及顶撞老师危害性的文章，并让他做了发言材料
label77,我在接受他的认错、道歉的同时帮他分析了当时的情况，以及可能产生的后果，并且告诉他，如果他态度不变，我决不会改变立场
label112,我先把大致的情况跟她说了一下，尤其强调了抄袭作业的不良后果及他这次的恶劣态度，希望他妈妈严加管教，同时我还把上周史同学考的分数给他妈看了一下，以增加她对儿子问题严重性的认识
label73,他也不是真的认为自己没错，只是从来没有在全班同学面前做过检讨，也没有被老师当着全班这么多同学的面这么严厉的批评，他觉得老师的做法让自己很没面子，所以态度才那么恶劣
label2,：“他身高比我高，如果硬拉，而且他又不与以配合，那我将下不了台
label1,七（5）
label2,男生
label15,这名学生行为习惯比较散漫，上课喜欢乱插话，
label27,学习上回家作业按时完成很少，作业完成质量极差
label13,对于教师的主动劝说，就当耳边风，多名任课老师为此比较头痛
label14,上课他经常无故发呆，神情恍惚，作业质量大幅下降，成绩也逐渐下滑
label26,作业质量大幅下降，成绩也逐渐下滑
label42,父母均为生计，对于他督促比较疏忽
label27,自己有放弃的心理，学习上缺乏主动性，不肯主动问老师问题。
label76,由于父母均比较忙，现在主要由姐姐来管
label113,与其家长保持经常联系；随时把握他的最新情况，并以这些情况作为方案事实的依据
label95,他的每一次改变，予以及时的表扬
label104,对其父母进行引导；逐渐增加他们对孩子的希望
label94,适当的多对他进行提问；尽量多对他进行表扬。
label98,尽量多对他进行表扬
label80,我通过当面沟通、周记指导、同学了解等方式及时的把握住他的每一丝动态，并给予他相应的指导，让他感觉到我完完全全是为他的发展着想，是他难得一见的真心朋友
label1,一年级
label15,上课不遵守纪律，注意力不集中，东张西望
label28,注意力不集中，东张西望
label15,坐不了几分钟就动桌椅、摇头晃脑，还经常招惹周围的同学，影响别人上课
label13,课余时间爱搞“恶作剧”，欺负其他同学
label27,书写很不认真，作业也不能准时按量完成，学习习惯差，学习态度极不端正，
label77,我收起了影响了他课堂学习的美术书，并及时对他进行思想诱导
label99,我把他平时画得比较好的画张贴在学习园地上，让同学学习、欣赏
label98,并时不时的抓住他的闪光点表扬了他
label78,并利用课间，放学后的活动空隙经常和他在一起，和他聊天，和他说笑，让他觉得老师和蔼可亲、平易近人
label74,上课不遵守纪律，注意力不集中，东张西望；坐不了几分钟就动桌椅、摇头晃脑，还经常招惹周围的同学，影响别人上课；课余时间爱搞“恶作剧”，欺负其他同学；书写很不认真，作业也不能准时按量完成，学习习惯差，学习态度极不端正，是一个多方面原因造成的后进生
label1,高一
label24,但是他有个缺点，脾气很急，特别容易暴躁
label15,曾经有一次在历史课上，因为他的笔袋被他不小心掉到了楼下，他要求捡回，历史老师不允许，他很不满意，就不顾老师直接走出了教室
label77,但之后不久的一件事使我意识到这个孩子还是需要老师们进一步的教育，让他自己管理自己真的不是一件容易的事情
label16,那是学校篮球联赛期间的一天，中午有我班比赛，早自习时我在班外观察情况，发现有几名男生的座位是空着的，当时我很生气，但是我想与其去寻找他们不如在门口等着他们出现。不一会，他们几个人就大汗淋漓的走了上来，于是我把他们几个人带到了办公室询问情况。了解清楚之后我很是生气，原来他们是因为要准备篮球联赛所以才没有及时回来上早自习，而他们认为早自习并不重要，这种学习态度让我很是不满
label27,那是学校篮球联赛期间的一天，中午有我班比赛，早自习时我在班外观察情况，发现有几名男生的座位是空着的，当时我很生气，但是我想与其去寻找他们不如在门口等着他们出现。不一会，他们几个人就大汗淋漓的走了上来，于是我把他们几个人带到了办公室询问情况。了解清楚之后我很是生气，原来他们是因为要准备篮球联赛所以才没有及时回来上早自习，而他们认为早自习并不重要，这种学习态度让我很是不满。这几个学生平时就是问题学生，包括小邓，问题已经一大堆，我想这次我不能只是进行教育，因为这种不学习、随便翘课的风气如果镇压不住的话，就会在班内造成很坏的影响
label27,他就开始变本加厉的出现各种各样的问题，学习不再专心，纪律不再严格遵守，不仅影响到自己，也影响了班内的其他同学
label15,他就开始变本加厉的出现各种各样的问题，学习不再专心，纪律不再严格遵守，不仅影响到自己，也影响了班内的其他同学
label78,于是我深吸了一口气，开始转变谈话角度，谈到了我自己，我和他的关系，也谈到了他身上的毛病，谈到了他的未来，他的人生之路等等
label98,我真的很是触动，当即给他写了回信，表扬他的懂事和进步的决心，我相信只要他肯努力，一定能取得更大的进步
label84,班主任在与学生进行“对话”时，除了要真诚、细致外，还必须要充分尊重学生的人格和情感，应多用商量式的语气、建议式的口吻。不能不顾学生的意愿、情感，强迫学生接受自己的意见，把自己凌驾于学生之上，也应靠爱心、靠理解和尊重帮助学生更大的进步
label2,他
label14,他课上总是爱摆弄东西，吃东西
label11,谁和他玩他就说谁欺负他，还说脏话，欺负女生，不是捏捏这个的耳朵就是薅薅那个的小辫子
label12,谁和他玩他就说谁欺负他，还说脏话，欺负女生，不是捏捏这个的耳朵就是薅薅那个的小辫子
label23,最可怕的是还对母亲说活着没意思，想自杀
label105,先与家长交流，期望家长能领孩子看医生。
label6,孩子真的是由于生病造成的，那么就耽误了孩子的治疗，
label14,在课堂上的他总是与其他同学的学习不同步。不是在看字典就是摆弄手指，有时甚至吃他喜欢的小食品，或者索性自言自语
label77,我用下课的时间找他谈心告诉他课堂上守纪律那是小学生就应具备的好习惯
label92,针对他聪明善于分析问题这方面给他安排了学习委员的任务
label86,放下架子亲近他，敞开心扉，以关爱之心来触动他的心弦。“动之于情，晓之于理”:用师爱去温暖他，用情去感化他，用理去说服他，从而促使他主动地改正错误
label104,与家长谈话时，要尊重家长，面带微笑。使家长感到教师是真诚的，是爱他们的孩子的，让家长感受到你的出发点是为了他（她）的孩子
label76,孩子真的是由于生病造成的
label26,语文不是仅靠智商就能解决的，它要求一种勤奋，而这名学生在语文学科上却没有表现出丝毫的勤奋，语文从未超过60分，在成绩单上倒数第五六个基本就是他，他自己说他的梦想就是语文能及格。
label14,他将手背后，眼睛还看自己的书，手放在后座的书上，看没什么反应，就一直悄悄地往外拽，直到掉在地上
label13,别人地携带系在凳腿上，在别人地墨水瓶里洒洗衣粉，在别人地眼镜上滴墨水，美其名曰，做“太阳镜”。
label11,偷着打别人更是常有的事，有时，下课时，我就能看见其他同学追着打他，眼睛里喷射的都是忍无可忍的愤怒目光
label15,有一天上晚自习，我看见他将卷子撕成长纸条，大约有20张纸条，我看见了，但我没多想，所以我也没说什么，过一会，他将纸条搓成小纸卷，然后拿起一个，一用力，这个小纸卷就冲向了另一个男同学宽广的脑门
label76,一把钥匙开一把锁，每个学生都有他所在乎的东西，这个点很可能就会成为转变学生的一个契机
label91,我找个日记本，开始详细的记录，某日第几节课几点几分，他做了什么，迟到，说话，小动作，一个不落
label15,上课要么扰乱他人学习，
label23,要么情绪低落
label14,自习课时不是说话就是睡觉
label11,下课胡乱打闹，同学间经常闹矛盾，同学们都嫌弃他；
label27,不做作业，各门功课单元考试不及格??
label54,他的父亲前两年因故坐过牢
label40,他的母亲脾气又非常暴躁，非骂既打
label69,特殊的家庭环境造成他年纪小小正需父母疼爱之时却无人疼爱，内心充满仇恨
label78,首先设法接近他，清除隔阂，拉近关系
label95,只要他的学习有一点进步时我就及时给予表扬、激励
label101,我安排班长和学习委员与他交流讨论学习生活
label92,让他当纪律委员。在他的努力下，这学期我班的纪律更加良好，还夺取了学校“示范班”荣誉称号
label2,性别：女
label3,年龄：九岁
label1,三年级学生
label27,学习无主动性
label31,与人相处办事，不计后果，自制能力差，没有责任感
label18,最大特点就是爱拿家里钱和别人东西。
label54,父亲在他一岁时，就外出打工，因做违法的事，被送进牢房里
label64,他就和爷爷奶奶在一起生活，通过邻居采访，爷爷奶奶思想观念落后，嫌弃他是个女孩子
label27,学习缺乏自觉性，老师布置的作业完成了事，多一点也不想做，没有毅力克服学习上的困难，基础打得不牢，使学习成绩处于下游。
label26,没有毅力克服学习上的困难，基础打得不牢，使学习成绩处于下游。
label18,特别是他有个毛病：爱偷东西。经常在同学的座位间走来走去，看人家有什么好东西或是零花钱，顺手拿来。
label23,使他有了情绪低落，性情浮躁
label12,更严重的是，有的时候与同学发生争吵会说用彝语乱说脏话骂人，再不就躺在地上耍赖，大声的哭，在不管老师说什么她也不理。有时候真是又好笑又好气
label69,缺乏一种必要的约束力，凡事随心所欲，加上家人又歧视她，使他生活在很松弛的生活状态中，这样容易出错事，造成不可估量的后果
label76,鉴于他从小几乎没人管教，缺乏一种必要的约束力，凡事随心所欲
label111,经常家访，改变爷爷奶奶歧视她的态度，与爷爷奶奶配合共同对他进行耐心细致的教育和帮助，使她改变了
label77,耐心指导，认真帮助他分析错误原因，让他自己找出错误所在。同时，没有放松对他的教育
label86,用爱心去关怀爱护，用爱心去严格要求，使他真正理解教师对他的关爱，有利于形成他良好的行为规范。
label98,激发他热爱生活，热爱劳动的热情，值日生工作他认真做，就给予鼓励主动帮助教师拿教具等则给予肯定
label98,挖掘小花的闪光点，把他的优点和进步放大，让他重新找到自信，让她重新在其他孩子心中树立形象
label85,我营造一个平等、友爱、和谐的集体氛围。有了以上的基础，我开始将他融入班集体中
label95,让他在学校写作业，每天的作业他都写得很认真，每一次来问我题的时候，他的态度都很诚恳，回去都能及时地去改正错题，完成作业，这时我都不会忘记去表扬他、鼓励他，让他更加自信，而且他很聪明，每一次给他讲题，总是一点就透，有的时候没等我说完，他就说“老师我明白了。”回去马上就能写出答案
label69,小俞渴望母爱的心终于得到了抚慰
label76,他由于缺乏家庭教育
label16,沾染了抽烟等不良习气
label27,老师，谢谢您对我的关心，我不想读书了，不要找我
label37,父母离异
label84,孩子们在老师这里感受到爱的同时，也懂得了应该怎样去爱同学、爱集体、爱学校，以至懂得爱祖国、爱人民
label86,她的爱心说来也简单，就是把所有的学生都当成自己的孩子
label2,他
label11,在我的班级中有一个爱打学生的男孩
label2,他
label11,在班级中，在操场上，他在和同学玩的时候，经常有同学或值 周老师告诉我，说他打人了。是啊，一直以来，班级里有很多同学被他打。
label76,他不加思索地回答：“爸爸告诉我，谁惹我，就打他。”听完这句话，我的心一沉，心情顿时沉重起来，并意识到，教育好孩子的关键，必须改变孩子父母偏激的教育思想
label111,作为班主任，就一定要说服家长，配合自己进行教育，才能够从思想上引导好学生
label98,作为班主任，就要善于发现孩子身上的优点，进行鼓励，才能够帮助学生自觉约束自己。
label92,由于开展班级干部轮换制度，同学们人人都可以得到锻炼，当我宣布这个规定时，王鑫也请求当班级干部。听到他的想法，我高兴地说：“好，老师一定让你当。不过，我对你有一个要求，就是一定要严格要求自己
label111,班主任要注意家校互相配合，共同校正他的行为
label2,，男
label3,17岁
label1,高一
label41,　父母常年在外经商，从小都是爷爷奶奶带，祖辈对其比较宠爱，可是本身的教育能力不高
label40,平时对孩子要么放任不管，要么只会责骂，一听说成绩不理想，就是一顿打骂。
label26,该生学习不高，平时较为自由散漫
label30,性格方面以自我为中心、狂躁，自我约束能力差
label27,学习方面兴趣不浓
label41,祖辈一昧迁就、给予、满足，导致孩子对物质需求的欲望恶性膨胀，攀比虚荣，事事以我为中心
label105,深入家庭，进行家教指导。
label76,教育方法的粗暴虽然祖辈对小孩在生活方面极其宠爱，但对他的学习期望又很高。他们认为自己的文化程度不高，孙子应该弥补他们的缺憾。因此，他们对小孩的学习成绩很重视，一听说成绩不理想，就是一顿打骂，很少有耐心地说理与交谈
label104,形成浓厚的家庭文化教育氛围，帮助孩子形成自觉学习的态度，改变家长对家庭教育的认识，提高家庭教育的质量。
label98,发现他积极的因素，促进转化
label98,跑步在班级里数一数二，做错事敢于承认，不闹事的时候还挺讨人喜欢，上课也会积极发言……所以我们可以发掘他这些向上的可塑性，对他进行再教育
label94,首先，我在课堂中，多为李冠提供表现机会，结合班上具体情况，开展一些集体的活动和竞赛，任命他为负责人，让他感到被信任和责任感，在组织活动中，他的主动参与使他觉得班上的活动，自己也是一份子，从而达到消除行为惰性的效果
label97,运用多种评价，促进发展
label85,我在培养他的正确的交往能力的时候，还注意发挥集体和伙伴的作用，通过同学的忍耐和爱护，帮助他在集体中找回自我，学会交往
label1,六年级
label2,她
label21,总是低着头，很少与同学交往
label27,上课无精打采，毫无学习兴趣
label27,家庭作业经常一字未写
label22,如果教她的老师都是这样的看法，那么，她的自卑感会越来越强，自闭症会越来越严重，学习会越来越困难。
label37,原来她父母早年离异，她与父亲一起生活，父亲常年在外打工，将她托付给了奶奶
label69,缺乏爱的滋润，承受长期学习落后的打击，总是徘徊在无人关注的角落，让她产生了自闭的心理
label72,缺乏爱的滋润，承受长期学习落后的打击
label84,教师利用一切机会亲近她，以关爱之心、温暖之情来触动她的心弦，让她敞开心扉。
label85,我组织一些同学来帮助她，跟她一起玩，一起做作业，让她感受到同学对她的信任与尊重，感受到同学是自己的益友。
label98,与科任老师统一意见，用赏识的眼光来看待她。
label95,我们抓住这些表扬她、鼓励她。学习上的一点小进步，我们也没有忽视。在语文课上的一次听写词语中，这个沉默的女孩居然全都对了。我非常兴奋，对她大加表扬，并说：“看来世上无难事，只怕有心人，你看，这些词语你全默写对了，你一定昨晚复习了吧！你看比有些平时学习优秀的同学都好呢！
label2,他
label15,上课无精打采，要么搞小动作，要么影响别人学习，
label27,提不起一点学习的兴趣；
label11,下课追逐打闹，喜欢动手动脚
label27,作业不做，即使做了，也做不完整，书写相当潦草……
label95,他无论是在纪律上，还是在学习上，都有了明显的进步。当他有一点进步时，我就及时给予表扬、激励他
label82,为了提高他的学习成绩，除了在思想上教育他，感化他，我特意安排一个职责心强、学习成绩好的女同学跟他坐，目的是发挥同桌的力量。
label74,他处处感到老师在关心他。他也逐渐明确了学习的目的，端正了学习态度。
label77,我决定先让他认识自己的错误，树立做个受人喜欢的思想
label2,女孩
label1,高三
label26,遇到重大考试心理特别紧张，患得患失，以至于成绩不断下滑，
label98,对该同学主多以鼓励为主，善于捕捉她的闪光点，肯定她的成绩。
