label61,在进入本班级之前，有一部分同学已经相互熟识，他们有的是因为父母是同事，有的是因为在幼儿园里是同学，所以进入新学校，对他们来说只是换了一个地方。而小A则不同，她在这里一个同学也不认识，也不知道怎么跟其他同学交往，所以她下了课只能一个人。当然，也有同学愿意与她交朋友，但是小A孤僻的性格让许多小伙伴离她越来越远。孩子的童年离不开同龄儿童的交往，当她是孤身一人时，她只会越来越不爱说话。
label86,对待学生最重要的就是“心”与“爱”。对待孩子要有一定的耐心，对待一个性格内向的孩子需要更加的耐心。小A不愿意说话，所以在口语练习的课上我会与她和同桌一起练习，当要到她说话时，我们会一起停下来等她，不急着催促，等她慢慢地说出一些简单的句子。有时，她不会回答，那我就一点一点地启发，让她慢慢接受，从简单的短语到简单的句子，一步一步来。这是一个漫长的过程，有时会觉得无望，但耐心一点，再耐心一点，孩子的心门终有一天会打开。除了耐心地引导，还需要我们爱心地关怀。每个孩子都是渴望爱的，小A的父母也是爱孩子的，只是行为上有所不足，所以不能让孩子感受到她是被爱的。我们老师是孩子除父母外接触时间最长的长辈，我们的爱与关怀会使孩子冰封的心融化。在孩子遇到挫折时，将她搂在怀里安慰，当她觉得难堪时，给她一个微笑，这些都是爱的表现。
label98,为了让小A克服自卑，树立信心，我努力寻找孩子的闪光点，多给予机会，让他越来越自信。平时上课时，多提问她，从简单的开始，让她觉得学习没有想象的难，自己也能很棒。我发现她写字特别认真，虽然不是写得很漂亮但是端端正正，所以我就在同学们面前表扬她，把她的字展示给同学们看，这以后她就喜欢上了写字。抓住这些闪光的地方，及时给予表扬，让孩子觉得自己也是很棒的，是被老师喜欢的，渐渐地，我发现她的脸上有了笑容，也敢和其他同学交流了。
label40,小A自身性格的内向可以划分为怯懦、自卑和迷茫这几个方面。怯懦主要是受到了父亲的影响，这一点在之前的家庭方面已经分析过了。
label112,经常与该生父母沟通交流孩子在学校的情况，同时让父母知道他们在孩子成长中的重要性。
label105,父母要加强与孩子之间的情感交流，平日里要多爱抚孩子，多与孩子交谈，对孩子的缺点及错误要耐心说服，注意给孩子创设一个轻松、和谐、温馨的家庭环境，避免使孩子产生孤独寂寞和畏难的情感体现。在家里要多与孩子交谈，在交谈中了解孩子在学校的日常生活、与同学的交往情况以及目前孩子的思想状况。
label1,江苏省 无锡市东亭实验小学 阙震宇
label1,从教第三年，我调入了东亭实验小学遇到了小赵，那时他才三年级，第一次来上科学课。
label15,在第一节课上，我已经不记得我问了一个什么问题，只记得他把手举得老高，然后我很愉悦地让他回答，但是回答的结果却让我大失所望，这是一个完全表达不出自己意思的孩子，说了一大堆，基本就是不知所云。问题回答完后，班级里出现了一些嘲笑的声音，然而事情却没有就此结束，小赵坐下去以后就在下面自言自语，声音虽然不是很大，但是已经影响到课堂的正常教学。当时也没在意，以为他只是对那些嘲笑的声音不满发出的抗议，提醒之后继续了我的课堂教学。但是在随后几节课的教学中基本都是如此，要么就是回答不知所云，要么就是在座位上自言自语，经常因为处理他的问题导致课堂被切成一段一段的。
label26,从此我不再顾忌他的回答是否会打断课堂，反而鼓励他更多地回答问题，只是在以往的基础上，每次他回答完我会将我听懂的部分讲给全班同学听。随着次数的增多，慢慢地我变成了他的“翻译官”，而且我也渐渐地发现这是一个表达不出自己意思但知识量还不少的孩子，在他的发言中时不时会有一些亮点产生，那为什么一个知识量不错的孩子却表达不出自己的意思呢？原来在小赵的大脑中，这些科学知识都是一些残章片段，所以他回答的时候思维基本是到处跳跃的，无法将这些知识融会贯通，最终出现了不知所云的回答
label102,每当一些相关内容的课程结束后，我开始尝试让小赵画一张思维导图，通过他自己制作的思维导图，我就能真实地感受到他思维的基本情况，然后根据这个情况适时地给予指引，帮助他建立科学知识间的内在联系。随着时间的推移，小赵的回答慢慢有了指向性，虽然语言组织还不是很好，但明显能感到周围同学已经能大概明白他的意思了，而且我翻译的次数也慢慢地减少了
label75,原来在小赵的大脑中，这些科学知识都是一些残章片段，所以他回答的时候思维基本是到处跳跃的，无法将这些知识融会贯通，最终出现了不知所云的回答
label1,黑龙江省 哈尔滨市育民小学 闻春艳
label2,今天变化最大的是咖啡糖，因为长得太黑了，所以她的家人一直这样称呼她。
label21,一节课下来，她举了四次手，这让我如获珍宝，要知道之前的她，从不主动举手发言而且做事情慢，又爱惹事，不讲卫生，各科老师都对她黔驴技穷。惊奇的是一句“今天真漂亮啊！”竟有如此大的“魔力”。
label8,咖啡糖的爸爸跟我说过，她之前一直被留在老家跟着爷爷住，直至去年才接到这里来。我很难理解作为留守儿童的她心底守着的那份孤独和落寞，只是依稀能够感觉出她与其他孩子之间的那种隔阂和怯弱，我试图打破这种僵局，却似乎一直都找不到突破口
label94,于是，我叫了咖啡糖：“张医生，请你上来为第一个病人看看。”咖啡糖听到我这么称呼她，刚开始一愣，后来马上领悟了我这么称呼她的用意，非常高兴地上台，开始分析“病情”：“这个病人的病因出在忘记在这里进位了。”一边说，一边还拿着红色粉笔指着个位和十位之间的位置，并补上“1”，接着就在积的十位上将“7”改成“8”，说：“这样就治好了。”
label98,寻思了良久，感悟到用欣赏的目光去关注孩子的每一个闪光点，用喜悦的心情去赞许孩子的每一份努力！关注他们每一个眼神、每一个动作，走近孩子的世界，近些，再近些
label74,我很难理解作为留守儿童的她心底守着的那份孤独和落寞，只是依稀能够感觉出她与其他孩子之间的那种隔阂和怯弱，我试图打破这种僵局，却似乎一直都找不到突破口。
label72,直到有一日，在每个星期周末作业必备的周记中，她以一句“老师我告诉你一个秘密”为开头，深深吸引和打动了我。哦，原来，这孩子需要倾听，我恍然大悟。
label2,小胡，男，13岁
label3,小胡，男，13岁
label15,小胡个子较高，长得比同龄的孩子大，坐在教室靠墙边的倒数第二个位置，上课总是一副懒散的样子。对老师也总是爱搭不理，上课时总是打扰其他同学，和同学的关系也非常紧张，总是和同学打架，欺负比自己弱小的同学。但是对老师组织的活动特别积极，可因为他平时表现不好，总是没有机会上场，不让他上场，他就变本加厉地扰乱课堂，形成了一种恶性循环。
label11,小胡个子较高，长得比同龄的孩子大，坐在教室靠墙边的倒数第二个位置，上课总是一副懒散的样子。对老师也总是爱搭不理，上课时总是打扰其他同学，和同学的关系也非常紧张，总是和同学打架，欺负比自己弱小的同学。但是对老师组织的活动特别积极，可因为他平时表现不好，总是没有机会上场，不让他上场，他就变本加厉地扰乱课堂，形成了一种恶性循环。
label62,小胡个子较高，长得比同龄的孩子大，坐在教室靠墙边的倒数第二个位置，上课总是一副懒散的样子。对老师也总是爱搭不理，上课时总是打扰其他同学，和同学的关系也非常紧张，总是和同学打架，欺负比自己弱小的同学。但是对老师组织的活动特别积极，可因为他平时表现不好，总是没有机会上场，不让他上场，他就变本加厉地扰乱课堂，形成了一种恶性循环。
label11,我上美术课时，小胡总是歪歪扭扭地坐着，一只手拿着笔，懒洋洋地趴在桌子上。别的同学在画画的时候，他总是不画，而是看着其他同学，一有机会就去欺负人家。但是一到提问的时候他总是非常积极，恨不得把手都举到老师的讲台上去。有时叫到他他答不上来，但是坐下之后他还是举手。
label72,他上课懒散是因为他总是不被人认可，想用这种玩世不恭的方式来引起别人的注意；他举手积极回答问题是为了获得一个在大家面前表现的机会，想要获得一种赞同，找回自己在集体中的地位。
label73,他上课懒散是因为他总是不被人认可，想用这种玩世不恭的方式来引起别人的注意；他举手积极回答问题是为了获得一个在大家面前表现的机会，想要获得一种赞同，找回自己在集体中的地位。
label94,对于他举手但答不上来，我每次都让他先坐下来，等他下次再举手时有意挑一些简单的一眼就能看出来的问题来提问，来提高他的积极性。
label73,出现上述情况的孩子同其他学生一样都有渴望得到家长、老师和同学的尊重的心理需要，但由于学习成绩差或某些行为习性差，很难达到家长和老师的期望，因而经常受到指责和批评，或由于家长长期的溺爱而形成骄横傲慢，唯我独尊，谁也惹不得的过度自尊心理，引起教师和同学的反感
label41,由于家长长期的溺爱而形成骄横傲慢，唯我独尊，谁也惹不得的过度自尊心理，引起教师和同学的反感。
label92,和问题学生建立起初步的可信赖的关系，给他们安排特殊的任务。比如，让他们照顾班级的花草、每天放学检查班级的窗户有没有关严等等简单的又需要每天都付出精力去干的事情，来释放他们过剩的精力，培养他们的温和的脾气和爱心，来融解他们的戾气。
label84,树立教师在孩子心目中的公正的高大形象。在建立起这种可信赖的关系之后，不要指望孩子就会立即对你百依百顺，他们会不时地通过各种途径来考验你是不是真的值得信赖，因为他们以前可能经历过太多被欺骗的例子，所以变得多疑，不会轻易相信别人。这时你要一如既往地表现出你的公正的好品质，有时是要公正得像个大法官一样。这样使孩子对你产生一种敬畏。
label1,北京市 海淀区红英小学 甄伟
label1,笔者在任教初期，担任五年级（1）班的科学老师
label2,在进行了一个星期的教学后，发现班上有一个男同学能够认真完成教师布置的任务，从来不像其他小朋友有过抱怨，多次受到表扬，但是在课堂上非常安静，不够积极主动
label21,在小组探究过程中，笔者发现这名男同学几乎不与小组成员交流，全程都是一个人在默默捯饬实验器材，同龄孩子该有的调皮、活泼他也全然没有。这时我意识到不是课堂的问题，而是孩子本身的心理出现了问题。
label32,于是笔者找到五（1）班班主任了解情况。原来这名学生以前性格活泼，自从有一次拿他爸爸的手机玩游戏刷掉了2000多元，被父亲暴打了一顿之后性格开始变得内向，不愿与人交流，表达能力差，现在还经常沉迷于打游戏，班主任和家长曾多次教导也是屡教不改。
label40,于是笔者找到五（1）班班主任了解情况。原来这名学生以前性格活泼，自从有一次拿他爸爸的手机玩游戏刷掉了2000多元，被父亲暴打了一顿之后性格开始变得内向，不愿与人交流，表达能力差，现在还经常沉迷于打游戏，班主任和家长曾多次教导也是屡教不改。
label104,首先是与学生家长取得联系，向他了解和反映一些情况，建议他们在家里给学生营造一个宽松的环境，暂时不要过多提及学习和游戏的话题
label80,与孩子沟通，笔者以游戏为突破口打开孩子的心灵窗口，经常向他询问一些游戏里的人物、技术攻略，然后慢慢地和他交流家里和学校的一些事情，他说自己并不知道刷掉爸爸的钱是真钱，喜欢打游戏也是因为和爸爸赌气
label92,在班上任命他为科学课代表，鼓励他多发言多上台展示。慢慢地，孩子变得愿意说话了，心里的结慢慢打开了
label73,最后一步是与孩子沟通，笔者以游戏为突破口打开孩子的心灵窗口，经常向他询问一些游戏里的人物、技术攻略，然后慢慢地和他交流家里和学校的一些事情，他说自己并不知道刷掉爸爸的钱是真钱，喜欢打游戏也是因为和爸爸赌气。可见，家长的一顿毒打让孩子的心理产生了阴影，表现出逆反心理
label20,在小组探究过程中，笔者发现这名男同学几乎不与小组成员交流，全程都是一个人在默默捯饬实验器材，同龄孩子该有的调皮、活泼他也全然没有。这时我意识到不是课堂的问题，而是孩子本身的心理出现了问题。
label1,二年级开学初，就听说老校区某个班有一个“一哭就声嘶力竭，无法自拔”的女生转学了，老师说现在终于不用再哄她了。
label2,二年级开学初，就听说老校区某个班有一个“一哭就声嘶力竭，无法自拔”的女生转学了，老师说现在终于不用再哄她了。
label24,我小心又小心了近一个月，她终于爆发了，“田老师，您快去教室看看吧！萱萱哭了，哄不住了。”我急忙跑去教室，还没有走到门口，就听到哇哇的哭声。走进教室，发现她坐在地上，声嘶力竭地哭，旁边围着许多同学，一个小男生，头低着站在旁边，我明白了：一定是他犯错了。
label24,我小心又小心了近一个月，她终于爆发了，“田老师，您快去教室看看吧！萱萱哭了，哄不住了。”我急忙跑去教室，还没有走到门口，就听到哇哇的哭声。走进教室，发现她坐在地上，声嘶力竭地哭，旁边围着许多同学，一个小男生，头低着站在旁边，我明白了：一定是他犯错了。
label24,果然，听她妈妈说开学一个星期还好，挺新鲜，每天高高兴兴的；第二个星期就不行了，每天哭，老师哄不了了，要家长出于对孩子的身心健康发展考虑，是否换个环境。于是，她妈妈又把她转回来了。
label68,原来有些孩子不是只会哭也会笑，而且笑起来会非常灿烂。作为班主任，我明白了：孩子的快乐，取决于老师给的“阳光”；孩子是否笑得灿烂，取决于老师给的“阳光”是否足够多。那么，老师给的“阳光”是什么呢？那就是对孩子的爱、温暖以及安全感。
label82,为了让她尽快融入班集体，我安排曾经和她在幼儿园时期同班的一个孩子——伊伊，下课陪她再次熟悉学校环境，消除陌生感。
label79,知道她是因为哭才一次次转学，所以当她第一次站在我面前的时候，我就得给她打好预防针：“萱萱，老师见到你很高兴，我喜欢学生的活泼与可爱，但我更喜欢爱笑的孩子，你会成为一个爱笑的孩子吗？”
label1,黑龙江省 哈尔滨市萧红小学 葛玉石
label16,本班的娜娜同学学习基础差，父母不务正业，父亲酗酒成性，在这样家庭条件下孩子产生了厌学心理，上学经常迟到，有时课间竟翻墙溜走，曾经多次教育，但收效不大，后来她竟被两个社会青年带去巴彦，学校家长几经周折，终于在巴彦一个小网吧里找到了她，面对脸色蜡黄，浑身尘土的孩子，我百感交集，意识到必须挽救她，把她从邪路上拉回来，这是教师的职责。
label27,本班的娜娜同学学习基础差，父母不务正业，父亲酗酒成性，在这样家庭条件下孩子产生了厌学心理，上学经常迟到，有时课间竟翻墙溜走，曾经多次教育，但收效不大，后来她竟被两个社会青年带去巴彦，学校家长几经周折，终于在巴彦一个小网吧里找到了她，面对脸色蜡黄，浑身尘土的孩子，我百感交集，意识到必须挽救她，把她从邪路上拉回来，这是教师的职责。
label54,本班的娜娜同学学习基础差，父母不务正业，父亲酗酒成性
label78,我多次家访，一次次与她谈心，让她摆脱坏人步入正途，此外，还利用业余时间给她补课
label100,我多次家访，一次次与她谈心，让她摆脱坏人步入正途，此外，还利用业余时间给她补课
label92,渐渐地，她对学习有了兴趣。我发现她个头高爱劳动，就让她当了劳动委员。
label70,本班的娜娜同学学习基础差，父母不务正业，父亲酗酒成性，在这样家庭条件下孩子产生了厌学心理
label28,班上有个学生叫腾腾。开学第一天上数学课，课堂上就表现出心神不定的样子。我当时没有批评他，而是等待下一次的表现。等到第二天上课，他仍然表现出一副心不在焉、无所事事的样子。
label28,接电话的是他的母亲。她说：“万老师，我也不知道是咋回事。我家腾腾做作业总是搔头抓耳的不好好写，也不好好吃饭，晚上翻来覆去也睡不着觉。你有啥办法吗？”
label23,下午，腾腾的母亲找到我的办公室，当着我的面说了很多，但最让我吃惊的是腾腾说给母亲的话：“妈妈，人活着没意思，我不想活了。”
label64,原来，腾腾的“疾病”来自心理：父母对现实生活的消极态度，伙伴对读书无用的消极观念，这种对生活无望的消极心态，严重地感染和影响了他，使这个本就脆弱的男孩渐渐变得沉默寡言、不爱学习，对未来生活充满了暗淡。
label14,班上有个学生叫腾腾。开学第一天上数学课，课堂上就表现出心神不定的样子。我当时没有批评他，而是等待下一次的表现。等到第二天上课，他仍然表现出一副心不在焉、无所事事的样子。
label27,在接近二十分钟的谈心中，我终于明白了：腾腾为什么上课不专心，为什么不好好写作业，为什么晚上睡不着觉。
label106,作为教师，当介入别人的家庭圈子做工作难免有所顾忌。腾腾的爸爸说我“多管闲事”，但经腾腾妈妈的一番说理之后，他终于明白了“万老师是为了咱家的孩子而这么做”，因此他一改以往从不顾孩子的懈怠行为，开始努力改变自己的一言一行，时时处处想着为孩子做出表率。况且，我把“改善夫妻关系，构建和谐家风”这一重任交给了腾腾的母亲。我深知，家庭教育是打底色的教育。家庭生活就是课堂，父母的言行就是课本，生活的情调就是文化，孩子的表现就是成绩单。只有重视家庭教育，才能奠定孩子健康成长的基石。
label2,他
label91,每天上学，我要求他步行按时到校，并给老师说说在家的表现；每天放学，我仍然要求他步行按时到家，并给家人说说在校的表现；每天早操、课间操、体育课，我要求他积极参加体育锻炼；每天课余时间，我要求他主动约同学做游戏。锻炼的坚持，活动的参与，腾腾渐渐变得活泼了、开朗了。
label86,在一个学年的时间里，我始终以一个父亲般的胸怀去关爱他、鼓励他，同时以一名教师的责任去教育他、引导他，他的脸上终于露出了和正常孩子一样的笑容。
label68,针对腾腾的消极心态，首先解决他晚上睡觉难以入眠的问题。刚开始，腾腾妈妈说，晚上她是一直陪着孩子睡觉，久而久之，孩子习惯了，没有她陪在身边睡觉，就难以入眠。
label1,甘肃省 平凉市庄浪县第一小学 万尚林
label104,作为教师，当介入别人的家庭圈子做工作难免有所顾忌。腾腾的爸爸说我“多管闲事”，但经腾腾妈妈的一番说理之后，他终于明白了“万老师是为了咱家的孩子而这么做”，因此他一改以往从不顾孩子的懈怠行为，开始努力改变自己的一言一行，时时处处想着为孩子做出表率。况且，我把“改善夫妻关系，构建和谐家风”这一重任交给了腾腾的母亲。我深知，家庭教育是打底色的教育。家庭生活就是课堂，父母的言行就是课本，生活的情调就是文化，孩子的表现就是成绩单。只有重视家庭教育，才能奠定孩子健康成长的基石。
label13,小浩是被全校师生贴上“调皮王、捣蛋鬼”标签的孩子。真不幸，分班的时候，这个难缠的“小魔头”分到了我们班。果然，刚开学不久，小浩就让我见识了他的“厉害”——课堂上，他总“有所作为”：时不时冒出一腔怪声，引得全班哄堂大笑；用把小镜子反射太阳光，晃同学们的眼睛；组长收发作业本，他故意伸出一条腿把人家绊倒……课间，他“小伎俩”层出不穷：偷偷往女生背后贴画着猪头的小纸条；趁其不备，搬开凳子，让同学坐空，摔个四脚朝天；捉来毛毛虫塞进同学书包，吓得人家“哇哇”大叫……作业经常满纸红叉叉，或者故意迟交，甚至根本没做。测试20多分，那是家常便饭
label15,小浩是被全校师生贴上“调皮王、捣蛋鬼”标签的孩子。真不幸，分班的时候，这个难缠的“小魔头”分到了我们班。果然，刚开学不久，小浩就让我见识了他的“厉害”——课堂上，他总“有所作为”：时不时冒出一腔怪声，引得全班哄堂大笑；用把小镜子反射太阳光，晃同学们的眼睛；组长收发作业本，他故意伸出一条腿把人家绊倒……课间，他“小伎俩”层出不穷：偷偷往女生背后贴画着猪头的小纸条；趁其不备，搬开凳子，让同学坐空，摔个四脚朝天；捉来毛毛虫塞进同学书包，吓得人家“哇哇”大叫……作业经常满纸红叉叉，或者故意迟交，甚至根本没做。测试20多分，那是家常便饭……
label27,小浩是被全校师生贴上“调皮王、捣蛋鬼”标签的孩子。真不幸，分班的时候，这个难缠的“小魔头”分到了我们班。果然，刚开学不久，小浩就让我见识了他的“厉害”——课堂上，他总“有所作为”：时不时冒出一腔怪声，引得全班哄堂大笑；用把小镜子反射太阳光，晃同学们的眼睛；组长收发作业本，他故意伸出一条腿把人家绊倒……课间，他“小伎俩”层出不穷：偷偷往女生背后贴画着猪头的小纸条；趁其不备，搬开凳子，让同学坐空，摔个四脚朝天；捉来毛毛虫塞进同学书包，吓得人家“哇哇”大叫……作业经常满纸红叉叉，或者故意迟交，甚至根本没做。测试20多分，那是家常便饭……
label29,表扬他象棋下得不错，他满脸傲慢地说：“他们这些人，根本就不是我的对手！想跟我斗？还嫩着呢！”
label37,与家长电话联系、微信聊天、上门家访，多种途径让我了解到，原来小浩生活在一个单亲家庭里。爸爸有外遇，逼妈妈离婚，抛下母子俩，和“小三”重组了新家庭。
label70,家庭的变故，让妈妈的脾气越发暴躁，原来听话、乖巧、善良的小浩，因为缺失父爱，常常做出一些过激的行为引起爸爸的关注——故意大冬天光着身子泡冷水，故意偷妈妈的钱，故意考试得低分，因为只有这样，才有机会见得爸爸一面。回到学校，他也常做种种怪异的行为，恶作剧不断，面对表扬鼓励，他也表现出异常的冷漠。家庭环境影响孩子的心灵成长，孩子内心深处的这扇紧锁的大门，我该如何打开呢？
label72,家庭的变故，让妈妈的脾气越发暴躁，原来听话、乖巧、善良的小浩，因为缺失父爱，常常做出一些过激的行为引起爸爸的关注——故意大冬天光着身子泡冷水，故意偷妈妈的钱，故意考试得低分，因为只有这样，才有机会见得爸爸一面。回到学校，他也常做种种怪异的行为，恶作剧不断，面对表扬鼓励，他也表现出异常的冷漠。家庭环境影响孩子的心灵成长，孩子内心深处的这扇紧锁的大门，我该如何打开呢？
label98,细心观察，发现闪光点，宣传正能量
label78,聊天散心，交知心朋友，记录成长足迹
label2,他
